"No.","Time","Source","Destination","Protocol","Length","Time since previous frame in this TCP stream","Info"
"28","0.000000","127.0.0.1","127.0.0.1","TCP","139","0.000084000","56903  >  9080 [PSH, ACK] Seq=1 Ack=1 Win=408256 Len=83 TSval=1426607499 TSecr=1426607499"
"38","0.000350","127.0.0.1","127.0.0.1","TCP","138","0.000065000","56905  >  9081 [PSH, ACK] Seq=1 Ack=1 Win=408256 Len=82 TSval=1426607500 TSecr=1426607500"
"56","2.188663","127.0.0.1","127.0.0.1","TCP","139","0.000069000","56911  >  9080 [PSH, ACK] Seq=1 Ack=1 Win=408256 Len=83 TSval=1426609677 TSecr=1426609677"
"66","0.000267","127.0.0.1","127.0.0.1","TCP","140","0.000042000","56912  >  9081 [PSH, ACK] Seq=1 Ack=1 Win=408256 Len=84 TSval=1426609678 TSecr=1426609678"
"78","0.000236","127.0.0.1","127.0.0.1","TCP","138","0.000111000","56913  >  9081 [PSH, ACK] Seq=1 Ack=1 Win=408256 Len=82 TSval=1426609678 TSecr=1426609678"
"92","0.000810","127.0.0.1","127.0.0.1","TCP","139","0.000539000","56915  >  9080 [PSH, ACK] Seq=1 Ack=1 Win=408256 Len=83 TSval=1426609679 TSecr=1426609678"
"94","0.000104","127.0.0.1","127.0.0.1","TCP","138","0.000169000","56917  >  9082 [PSH, ACK] Seq=1 Ack=1 Win=408256 Len=82 TSval=1426609679 TSecr=1426609679"
"108","0.000490","127.0.0.1","127.0.0.1","TCP","137","0.000183000","56918  >  9082 [PSH, ACK] Seq=1 Ack=1 Win=408256 Len=81 TSval=1426609679 TSecr=1426609679"
"141","9.504653","127.0.0.1","127.0.0.1","TCP","145","0.000392000","56923  >  8081 [PSH, ACK] Seq=1 Ack=1 Win=408256 Len=89 TSval=1426619132 TSecr=1426619132"
"149","0.000374","127.0.0.1","127.0.0.1","TCP","145","0.000072000","56924  >  8082 [PSH, ACK] Seq=1 Ack=1 Win=408256 Len=89 TSval=1426619133 TSecr=1426619132"
"158","0.000461","127.0.0.1","127.0.0.1","TCP","144","0.000104000","56925  >  8080 [PSH, ACK] Seq=1 Ack=1 Win=408256 Len=88 TSval=1426619133 TSecr=1426619133 [TCP segment of a reassembled PDU]"
"169","0.000264","127.0.0.1","127.0.0.1","TCP","145","0.000199000","56926  >  8080 [PSH, ACK] Seq=1 Ack=1 Win=408256 Len=89 TSval=1426619133 TSecr=1426619133 [TCP segment of a reassembled PDU]"
"179","0.000264","127.0.0.1","127.0.0.1","TCP","144","0.000348000","56927  >  8082 [PSH, ACK] Seq=1 Ack=1 Win=408256 Len=88 TSval=1426619133 TSecr=1426619133"
"183","0.000083","127.0.0.1","127.0.0.1","TCP","145","0.000174000","56928  >  8081 [PSH, ACK] Seq=1 Ack=1 Win=408256 Len=89 TSval=1426619134 TSecr=1426619133"
"200","10.907571","127.0.0.1","127.0.0.1","TCP","145","0.000085000","56929  >  8081 [PSH, ACK] Seq=1 Ack=1 Win=408256 Len=89 TSval=1426629998 TSecr=1426629998"
"210","0.000225","127.0.0.1","127.0.0.1","TCP","145","0.000034000","56930  >  8081 [PSH, ACK] Seq=1 Ack=1 Win=408256 Len=89 TSval=1426629998 TSecr=1426629998"
"220","0.000180","127.0.0.1","127.0.0.1","TCP","145","0.000041000","56931  >  8082 [PSH, ACK] Seq=1 Ack=1 Win=408256 Len=89 TSval=1426629998 TSecr=1426629998"
"231","0.000125","127.0.0.1","127.0.0.1","TCP","144","0.000026000","56932  >  8080 [PSH, ACK] Seq=1 Ack=1 Win=408256 Len=88 TSval=1426629998 TSecr=1426629998 [TCP segment of a reassembled PDU]"
"244","0.000161","127.0.0.1","127.0.0.1","TCP","145","0.000117000","56933  >  8082 [PSH, ACK] Seq=1 Ack=1 Win=408256 Len=89 TSval=1426629999 TSecr=1426629998"
"250","0.000041","127.0.0.1","127.0.0.1","TCP","145","0.000032000","56934  >  8080 [PSH, ACK] Seq=1 Ack=1 Win=408256 Len=89 TSval=1426629999 TSecr=1426629999 [TCP segment of a reassembled PDU]"
"264","0.000311","127.0.0.1","127.0.0.1","TCP","144","0.000148000","56935  >  8082 [PSH, ACK] Seq=1 Ack=1 Win=408256 Len=88 TSval=1426629999 TSecr=1426629999"
"272","0.000157","127.0.0.1","127.0.0.1","TCP","144","0.000270000","56936  >  8080 [PSH, ACK] Seq=1 Ack=1 Win=408256 Len=88 TSval=1426629999 TSecr=1426629999 [TCP segment of a reassembled PDU]"
"282","0.000213","127.0.0.1","127.0.0.1","TCP","145","0.000213000","56937  >  8082 [PSH, ACK] Seq=1 Ack=1 Win=408256 Len=89 TSval=1426629999 TSecr=1426629999"
"286","0.000046","127.0.0.1","127.0.0.1","TCP","144","0.000104000","56938  >  8081 [PSH, ACK] Seq=1 Ack=1 Win=408256 Len=88 TSval=1426629999 TSecr=1426629999"
"300","0.000469","127.0.0.1","127.0.0.1","TCP","144","0.000105000","56939  >  8080 [PSH, ACK] Seq=1 Ack=1 Win=408256 Len=88 TSval=1426630000 TSecr=1426630000 [TCP segment of a reassembled PDU]"
"310","0.000305","127.0.0.1","127.0.0.1","TCP","144","0.000062000","56940  >  8082 [PSH, ACK] Seq=1 Ack=1 Win=408256 Len=88 TSval=1426630000 TSecr=1426630000"
"320","12.739031","127.0.0.1","127.0.0.1","TCP","144","0.000108000","56942  >  8080 [PSH, ACK] Seq=1 Ack=1 Win=408256 Len=88 TSval=1426642689 TSecr=1426642689 [TCP segment of a reassembled PDU]"
"330","0.000188","127.0.0.1","127.0.0.1","TCP","144","0.000049000","56943  >  8080 [PSH, ACK] Seq=1 Ack=1 Win=408256 Len=88 TSval=1426642689 TSecr=1426642689 [TCP segment of a reassembled PDU]"
"341","0.000286","127.0.0.1","127.0.0.1","TCP","144","0.000092000","56944  >  8082 [PSH, ACK] Seq=1 Ack=1 Win=408256 Len=88 TSval=1426642689 TSecr=1426642689"
"354","0.000188","127.0.0.1","127.0.0.1","TCP","145","0.000127000","56945  >  8081 [PSH, ACK] Seq=1 Ack=1 Win=408256 Len=89 TSval=1426642690 TSecr=1426642689"
"355","0.000009","127.0.0.1","127.0.0.1","TCP","144","0.000048000","56946  >  8082 [PSH, ACK] Seq=1 Ack=1 Win=408256 Len=88 TSval=1426642690 TSecr=1426642690"
"376","0.000520","127.0.0.1","127.0.0.1","TCP","145","0.000365000","56947  >  8081 [PSH, ACK] Seq=1 Ack=1 Win=408256 Len=89 TSval=1426642690 TSecr=1426642690"
"380","0.000035","127.0.0.1","127.0.0.1","TCP","144","0.000082000","56948  >  8080 [PSH, ACK] Seq=1 Ack=1 Win=408256 Len=88 TSval=1426642690 TSecr=1426642690 [TCP segment of a reassembled PDU]"
"392","0.000248","127.0.0.1","127.0.0.1","TCP","143","0.000056000","56949  >  8081 [PSH, ACK] Seq=1 Ack=1 Win=408256 Len=87 TSval=1426642690 TSecr=1426642690"
"396","0.000051","127.0.0.1","127.0.0.1","TCP","144","0.000103000","56950  >  8080 [PSH, ACK] Seq=1 Ack=1 Win=408256 Len=88 TSval=1426642690 TSecr=1426642690 [TCP segment of a reassembled PDU]"
"410","0.000287","127.0.0.1","127.0.0.1","TCP","144","0.000083000","56951  >  8081 [PSH, ACK] Seq=1 Ack=1 Win=408256 Len=88 TSval=1426642691 TSecr=1426642691"
"415","0.000107","127.0.0.1","127.0.0.1","TCP","145","0.000186000","56952  >  8082 [PSH, ACK] Seq=1 Ack=1 Win=408256 Len=89 TSval=1426642691 TSecr=1426642691"
"430","0.000350","127.0.0.1","127.0.0.1","TCP","144","0.000278000","56953  >  8081 [PSH, ACK] Seq=1 Ack=1 Win=408256 Len=88 TSval=1426642691 TSecr=1426642691"
"434","0.000039","127.0.0.1","127.0.0.1","TCP","145","0.000227000","56954  >  8082 [PSH, ACK] Seq=1 Ack=1 Win=408256 Len=89 TSval=1426642691 TSecr=1426642691"
"448","0.000437","127.0.0.1","127.0.0.1","TCP","143","0.000221000","56955  >  8082 [PSH, ACK] Seq=1 Ack=1 Win=408256 Len=87 TSval=1426642692 TSecr=1426642691"
"462","0.000493","127.0.0.1","127.0.0.1","TCP","144","0.000173000","56956  >  8080 [PSH, ACK] Seq=1 Ack=1 Win=408256 Len=88 TSval=1426642692 TSecr=1426642692 [TCP segment of a reassembled PDU]"
"470","0.000204","127.0.0.1","127.0.0.1","TCP","144","0.000044000","56957  >  8081 [PSH, ACK] Seq=1 Ack=1 Win=408256 Len=88 TSval=1426642692 TSecr=1426642692"
"480","6.124569","127.0.0.1","127.0.0.1","TCP","144","0.000088000","56958  >  8080 [PSH, ACK] Seq=1 Ack=1 Win=408256 Len=88 TSval=1426648792 TSecr=1426648792 [TCP segment of a reassembled PDU]"
"489","0.000183","127.0.0.1","127.0.0.1","TCP","144","0.000048000","56959  >  8080 [PSH, ACK] Seq=1 Ack=1 Win=408256 Len=88 TSval=1426648792 TSecr=1426648792 [TCP segment of a reassembled PDU]"
"500","0.000194","127.0.0.1","127.0.0.1","TCP","142","0.000028000","56960  >  8080 [PSH, ACK] Seq=1 Ack=1 Win=408256 Len=86 TSval=1426648792 TSecr=1426648792 [TCP segment of a reassembled PDU]"
"510","0.000166","127.0.0.1","127.0.0.1","TCP","144","0.000034000","56961  >  8082 [PSH, ACK] Seq=1 Ack=1 Win=408256 Len=88 TSval=1426648792 TSecr=1426648792"
"521","0.000120","127.0.0.1","127.0.0.1","TCP","145","0.000008000","56962  >  8081 [PSH, ACK] Seq=1 Ack=1 Win=408256 Len=89 TSval=1426648793 TSecr=1426648793"
"534","0.000155","127.0.0.1","127.0.0.1","TCP","144","0.000116000","56963  >  8082 [PSH, ACK] Seq=1 Ack=1 Win=408256 Len=88 TSval=1426648793 TSecr=1426648793"
"540","0.000044","127.0.0.1","127.0.0.1","TCP","145","0.000014000","56964  >  8081 [PSH, ACK] Seq=1 Ack=1 Win=408256 Len=89 TSval=1426648793 TSecr=1426648793"
"550","0.000229","127.0.0.1","127.0.0.1","TCP","143","0.000046000","56965  >  8081 [PSH, ACK] Seq=1 Ack=1 Win=408256 Len=87 TSval=1426648793 TSecr=1426648793"
"566","0.000347","127.0.0.1","127.0.0.1","TCP","142","0.000167000","56967  >  8081 [PSH, ACK] Seq=1 Ack=1 Win=408256 Len=86 TSval=1426648793 TSecr=1426648793"
"567","0.000001","127.0.0.1","127.0.0.1","TCP","142","0.000258000","56966  >  8082 [PSH, ACK] Seq=1 Ack=1 Win=408256 Len=86 TSval=1426648793 TSecr=1426648793"
"584","0.000360","127.0.0.1","127.0.0.1","TCP","145","0.000149000","56968  >  8082 [PSH, ACK] Seq=1 Ack=1 Win=408256 Len=89 TSval=1426648794 TSecr=1426648794"
"585","0.000001","127.0.0.1","127.0.0.1","TCP","144","0.000050000","56969  >  8080 [PSH, ACK] Seq=1 Ack=1 Win=408256 Len=88 TSval=1426648794 TSecr=1426648794 [TCP segment of a reassembled PDU]"
"600","0.000278","127.0.0.1","127.0.0.1","TCP","141","0.000055000","56970  >  8080 [PSH, ACK] Seq=1 Ack=1 Win=408256 Len=85 TSval=1426648794 TSecr=1426648794 [TCP segment of a reassembled PDU]"
"601","0.000004","127.0.0.1","127.0.0.1","TCP","145","0.000055000","56971  >  8082 [PSH, ACK] Seq=1 Ack=1 Win=408256 Len=89 TSval=1426648794 TSecr=1426648794"
"616","0.000231","127.0.0.1","127.0.0.1","TCP","144","0.000039000","56972  >  8081 [PSH, ACK] Seq=1 Ack=1 Win=408256 Len=88 TSval=1426648794 TSecr=1426648794"
"619","0.000018","127.0.0.1","127.0.0.1","TCP","143","0.000052000","56973  >  8082 [PSH, ACK] Seq=1 Ack=1 Win=408256 Len=87 TSval=1426648794 TSecr=1426648794"
"632","0.000199","127.0.0.1","127.0.0.1","TCP","141","0.000050000","56974  >  8081 [PSH, ACK] Seq=1 Ack=1 Win=408256 Len=85 TSval=1426648794 TSecr=1426648794"
"643","0.000301","127.0.0.1","127.0.0.1","TCP","142","0.000347000","56975  >  8082 [PSH, ACK] Seq=1 Ack=1 Win=408256 Len=86 TSval=1426648795 TSecr=1426648794"
"660","0.000740","127.0.0.1","127.0.0.1","TCP","145","0.000069000","56976  >  8081 [PSH, ACK] Seq=1 Ack=1 Win=408256 Len=89 TSval=1426648795 TSecr=1426648795"
"670","0.000244","127.0.0.1","127.0.0.1","TCP","145","0.000052000","56977  >  8081 [PSH, ACK] Seq=1 Ack=1 Win=408256 Len=89 TSval=1426648796 TSecr=1426648796"
"680","0.000263","127.0.0.1","127.0.0.1","TCP","143","0.000049000","56978  >  8081 [PSH, ACK] Seq=1 Ack=1 Win=408256 Len=87 TSval=1426648796 TSecr=1426648796"
"690","0.000274","127.0.0.1","127.0.0.1","TCP","145","0.000060000","56979  >  8082 [PSH, ACK] Seq=1 Ack=1 Win=408256 Len=89 TSval=1426648796 TSecr=1426648796"
"700","0.000227","127.0.0.1","127.0.0.1","TCP","145","0.000048000","56980  >  8082 [PSH, ACK] Seq=1 Ack=1 Win=408256 Len=89 TSval=1426648796 TSecr=1426648796"
"710","0.000259","127.0.0.1","127.0.0.1","TCP","143","0.000052000","56981  >  8082 [PSH, ACK] Seq=1 Ack=1 Win=408256 Len=87 TSval=1426648797 TSecr=1426648797"
"720","5.899071","127.0.0.1","127.0.0.1","TCP","144","0.000074000","56982  >  8080 [PSH, ACK] Seq=1 Ack=1 Win=408256 Len=88 TSval=1426654670 TSecr=1426654670 [TCP segment of a reassembled PDU]"
"730","0.000216","127.0.0.1","127.0.0.1","TCP","141","0.000041000","56983  >  8080 [PSH, ACK] Seq=1 Ack=1 Win=408256 Len=85 TSval=1426654670 TSecr=1426654670 [TCP segment of a reassembled PDU]"
"740","0.000196","127.0.0.1","127.0.0.1","TCP","144","0.000043000","56984  >  8080 [PSH, ACK] Seq=1 Ack=1 Win=408256 Len=88 TSval=1426654671 TSecr=1426654670 [TCP segment of a reassembled PDU]"
"751","0.000250","127.0.0.1","127.0.0.1","TCP","144","0.000051000","56985  >  8081 [PSH, ACK] Seq=1 Ack=1 Win=408256 Len=88 TSval=1426654671 TSecr=1426654671"
"764","0.000320","127.0.0.1","127.0.0.1","TCP","141","0.000169000","56987  >  8081 [PSH, ACK] Seq=1 Ack=1 Win=408256 Len=85 TSval=1426654671 TSecr=1426654671"
"769","0.000110","127.0.0.1","127.0.0.1","TCP","145","0.000372000","56986  >  8081 [PSH, ACK] Seq=1 Ack=1 Win=408256 Len=89 TSval=1426654671 TSecr=1426654671"
"782","0.000233","127.0.0.1","127.0.0.1","TCP","144","0.000158000","56988  >  8081 [PSH, ACK] Seq=1 Ack=1 Win=408256 Len=88 TSval=1426654671 TSecr=1426654671"
"788","0.000162","127.0.0.1","127.0.0.1","TCP","145","0.000276000","56989  >  8081 [PSH, ACK] Seq=1 Ack=1 Win=408256 Len=89 TSval=1426654672 TSecr=1426654671"
"798","0.000262","127.0.0.1","127.0.0.1","TCP","143","0.000087000","56990  >  8081 [PSH, ACK] Seq=1 Ack=1 Win=408256 Len=87 TSval=1426654672 TSecr=1426654672"
"810","0.000218","127.0.0.1","127.0.0.1","TCP","144","0.000046000","56991  >  8080 [PSH, ACK] Seq=1 Ack=1 Win=408256 Len=88 TSval=1426654672 TSecr=1426654672 [TCP segment of a reassembled PDU]"
"813","0.000017","127.0.0.1","127.0.0.1","TCP","143","0.000047000","56992  >  8081 [PSH, ACK] Seq=1 Ack=1 Win=408256 Len=87 TSval=1426654672 TSecr=1426654672"
"826","0.000241","127.0.0.1","127.0.0.1","TCP","144","0.000043000","56993  >  8080 [PSH, ACK] Seq=1 Ack=1 Win=408256 Len=88 TSval=1426654672 TSecr=1426654672 [TCP segment of a reassembled PDU]"
"827","0.000002","127.0.0.1","127.0.0.1","TCP","145","0.000050000","56994  >  8082 [PSH, ACK] Seq=1 Ack=1 Win=408256 Len=89 TSval=1426654672 TSecr=1426654672"
"843","0.000215","127.0.0.1","127.0.0.1","TCP","142","0.000051000","56996  >  8080 [PSH, ACK] Seq=1 Ack=1 Win=408256 Len=86 TSval=1426654672 TSecr=1426654672 [TCP segment of a reassembled PDU]"
"854","0.000206","127.0.0.1","127.0.0.1","TCP","145","0.000253000","56995  >  8082 [PSH, ACK] Seq=1 Ack=1 Win=408256 Len=89 TSval=1426654673 TSecr=1426654672"
"856","0.000016","127.0.0.1","127.0.0.1","TCP","144","0.000091000","56997  >  8080 [PSH, ACK] Seq=1 Ack=1 Win=408256 Len=88 TSval=1426654673 TSecr=1426654673 [TCP segment of a reassembled PDU]"
"870","0.000215","127.0.0.1","127.0.0.1","TCP","144","0.000043000","56999  >  8082 [PSH, ACK] Seq=1 Ack=1 Win=408256 Len=88 TSval=1426654673 TSecr=1426654673"
"871","0.000010","127.0.0.1","127.0.0.1","TCP","143","0.000049000","56998  >  8082 [PSH, ACK] Seq=1 Ack=1 Win=408256 Len=87 TSval=1426654673 TSecr=1426654673"
"888","0.000212","127.0.0.1","127.0.0.1","TCP","144","0.000053000","57001  >  8082 [PSH, ACK] Seq=1 Ack=1 Win=408256 Len=88 TSval=1426654673 TSecr=1426654673"
"895","0.000125","127.0.0.1","127.0.0.1","IRC","143","0.000174000","Response ({""src"":)"
"914","0.000524","127.0.0.1","127.0.0.1","TCP","142","0.000520000","57002  >  8082 [PSH, ACK] Seq=1 Ack=1 Win=408256 Len=86 TSval=1426654674 TSecr=1426654673"
"926","0.000404","127.0.0.1","127.0.0.1","TCP","144","0.000196000","57003  >  8082 [PSH, ACK] Seq=1 Ack=1 Win=408256 Len=88 TSval=1426654674 TSecr=1426654674"
"942","0.000965","127.0.0.1","127.0.0.1","TCP","144","0.000224000","57004  >  8080 [PSH, ACK] Seq=1 Ack=1 Win=408256 Len=88 TSval=1426654675 TSecr=1426654675 [TCP segment of a reassembled PDU]"
"950","0.000323","127.0.0.1","127.0.0.1","TCP","144","0.000064000","57005  >  8080 [PSH, ACK] Seq=1 Ack=1 Win=408256 Len=88 TSval=1426654675 TSecr=1426654675 [TCP segment of a reassembled PDU]"
"960","0.000249","127.0.0.1","127.0.0.1","TCP","142","0.000052000","57006  >  8080 [PSH, ACK] Seq=1 Ack=1 Win=408256 Len=86 TSval=1426654676 TSecr=1426654676 [TCP segment of a reassembled PDU]"
"970","0.000278","127.0.0.1","127.0.0.1","TCP","144","0.000049000","57007  >  8082 [PSH, ACK] Seq=1 Ack=1 Win=408256 Len=88 TSval=1426654676 TSecr=1426654676"
"980","0.000204","127.0.0.1","127.0.0.1","TCP","144","0.000043000","57008  >  8082 [PSH, ACK] Seq=1 Ack=1 Win=408256 Len=88 TSval=1426654676 TSecr=1426654676"
"990","0.000218","127.0.0.1","127.0.0.1","TCP","142","0.000046000","57009  >  8082 [PSH, ACK] Seq=1 Ack=1 Win=408256 Len=86 TSval=1426654676 TSecr=1426654676"
"1000","4.072398","127.0.0.1","127.0.0.1","TCP","144","0.000342000","57010  >  8080 [PSH, ACK] Seq=1 Ack=1 Win=408256 Len=88 TSval=1426658737 TSecr=1426658737 [TCP segment of a reassembled PDU]"
"1010","0.000278","127.0.0.1","127.0.0.1","TCP","141","0.000036000","57011  >  8080 [PSH, ACK] Seq=1 Ack=1 Win=408256 Len=85 TSval=1426658737 TSecr=1426658737 [TCP segment of a reassembled PDU]"
"1020","0.000191","127.0.0.1","127.0.0.1","TCP","144","0.000040000","57012  >  8080 [PSH, ACK] Seq=1 Ack=1 Win=408256 Len=88 TSval=1426658738 TSecr=1426658738 [TCP segment of a reassembled PDU]"
"1030","0.000214","127.0.0.1","127.0.0.1","TCP","144","0.000037000","57013  >  8080 [PSH, ACK] Seq=1 Ack=1 Win=408256 Len=88 TSval=1426658738 TSecr=1426658738 [TCP segment of a reassembled PDU]"
"1041","0.000197","127.0.0.1","127.0.0.1","TCP","144","0.000036000","57014  >  8081 [PSH, ACK] Seq=1 Ack=1 Win=408256 Len=88 TSval=1426658738 TSecr=1426658738"
"1050","0.000131","127.0.0.1","127.0.0.1","TCP","145","0.000055000","57015  >  8081 [PSH, ACK] Seq=1 Ack=1 Win=408256 Len=89 TSval=1426658738 TSecr=1426658738"
"1062","0.000128","127.0.0.1","127.0.0.1","TCP","141","0.000114000","57016  >  8081 [PSH, ACK] Seq=1 Ack=1 Win=408256 Len=85 TSval=1426658738 TSecr=1426658738"
"1066","0.000084","127.0.0.1","127.0.0.1","TCP","145","0.000091000","57017  >  8081 [PSH, ACK] Seq=1 Ack=1 Win=408256 Len=89 TSval=1426658738 TSecr=1426658738"
"1082","0.000322","127.0.0.1","127.0.0.1","TCP","143","0.000188000","57018  >  8081 [PSH, ACK] Seq=1 Ack=1 Win=408256 Len=87 TSval=1426658739 TSecr=1426658739"
"1092","0.000144","127.0.0.1","127.0.0.1","TCP","144","0.000235000","57019  >  8081 [PSH, ACK] Seq=1 Ack=1 Win=408256 Len=88 TSval=1426658739 TSecr=1426658739"
"1102","0.000242","127.0.0.1","127.0.0.1","TCP","143","0.000253000","57020  >  8081 [PSH, ACK] Seq=1 Ack=1 Win=408256 Len=87 TSval=1426658739 TSecr=1426658739"
"1115","0.000288","127.0.0.1","127.0.0.1","TCP","144","0.000332000","57021  >  8081 [PSH, ACK] Seq=1 Ack=1 Win=408256 Len=88 TSval=1426658739 TSecr=1426658739"
"1120","0.000092","127.0.0.1","127.0.0.1","TCP","144","0.000225000","57022  >  8081 [PSH, ACK] Seq=1 Ack=1 Win=408256 Len=88 TSval=1426658739 TSecr=1426658739"
"1129","0.000350","127.0.0.1","127.0.0.1","TCP","145","0.000138000","57023  >  8082 [PSH, ACK] Seq=1 Ack=1 Win=408256 Len=89 TSval=1426658740 TSecr=1426658740"
"1142","0.000203","127.0.0.1","127.0.0.1","TCP","144","0.000177000","57024  >  8080 [PSH, ACK] Seq=1 Ack=1 Win=408256 Len=88 TSval=1426658740 TSecr=1426658740 [TCP segment of a reassembled PDU]"
"1152","0.000182","127.0.0.1","127.0.0.1","TCP","145","0.000222000","57025  >  8082 [PSH, ACK] Seq=1 Ack=1 Win=408256 Len=89 TSval=1426658740 TSecr=1426658740"
"1155","0.000016","127.0.0.1","127.0.0.1","TCP","144","0.000040000","57026  >  8080 [PSH, ACK] Seq=1 Ack=1 Win=408256 Len=88 TSval=1426658740 TSecr=1426658740 [TCP segment of a reassembled PDU]"
"1168","0.000206","127.0.0.1","127.0.0.1","TCP","143","0.000058000","57027  >  8082 [PSH, ACK] Seq=1 Ack=1 Win=408256 Len=87 TSval=1426658740 TSecr=1426658740"
"1172","0.000030","127.0.0.1","127.0.0.1","TCP","142","0.000082000","57028  >  8080 [PSH, ACK] Seq=1 Ack=1 Win=408256 Len=86 TSval=1426658740 TSecr=1426658740 [TCP segment of a reassembled PDU]"
"1188","0.000342","127.0.0.1","127.0.0.1","TCP","143","0.000161000","57030  >  8082 [PSH, ACK] Seq=1 Ack=1 Win=408256 Len=87 TSval=1426658741 TSecr=1426658741"
"1196","0.000330","127.0.0.1","127.0.0.1","TCP","143","0.000489000","57029  >  8080 [PSH, ACK] Seq=1 Ack=1 Win=408256 Len=87 TSval=1426658741 TSecr=1426658741 [TCP segment of a reassembled PDU]"
"1206","0.000223","127.0.0.1","127.0.0.1","TCP","144","0.000288000","57031  >  8082 [PSH, ACK] Seq=1 Ack=1 Win=408256 Len=88 TSval=1426658741 TSecr=1426658741"
"1210","0.000026","127.0.0.1","127.0.0.1","TCP","144","0.000058000","57032  >  8082 [PSH, ACK] Seq=1 Ack=1 Win=408256 Len=88 TSval=1426658741 TSecr=1426658741"
"1230","0.000581","127.0.0.1","127.0.0.1","TCP","144","0.000415000","57033  >  8082 [PSH, ACK] Seq=1 Ack=1 Win=408256 Len=88 TSval=1426658742 TSecr=1426658742"
"1242","0.000262","127.0.0.1","127.0.0.1","TCP","142","0.000053000","57035  >  8082 [PSH, ACK] Seq=1 Ack=1 Win=408256 Len=86 TSval=1426658742 TSecr=1426658742"
"1243","0.000007","127.0.0.1","127.0.0.1","TCP","145","0.000056000","57034  >  8081 [PSH, ACK] Seq=1 Ack=1 Win=408256 Len=89 TSval=1426658742 TSecr=1426658742"
"1262","0.000405","127.0.0.1","127.0.0.1","TCP","145","0.000123000","57037  >  8081 [PSH, ACK] Seq=1 Ack=1 Win=408256 Len=89 TSval=1426658743 TSecr=1426658742"
"1263","0.000000","127.0.0.1","127.0.0.1","TCP","143","0.000252000","57036  >  8082 [PSH, ACK] Seq=1 Ack=1 Win=408256 Len=87 TSval=1426658743 TSecr=1426658742"
"1278","0.000336","127.0.0.1","127.0.0.1","TCP","143","0.000149000","57038  >  8081 [PSH, ACK] Seq=1 Ack=1 Win=408256 Len=87 TSval=1426658743 TSecr=1426658743"
"1288","0.000219","127.0.0.1","127.0.0.1","TCP","143","0.000048000","57039  >  8081 [PSH, ACK] Seq=1 Ack=1 Win=408256 Len=87 TSval=1426658743 TSecr=1426658743"
"1300","0.000207","127.0.0.1","127.0.0.1","TCP","145","0.000045000","57040  >  8082 [PSH, ACK] Seq=1 Ack=1 Win=408256 Len=89 TSval=1426658743 TSecr=1426658743"
"1310","0.000200","127.0.0.1","127.0.0.1","TCP","145","0.000043000","57041  >  8082 [PSH, ACK] Seq=1 Ack=1 Win=408256 Len=89 TSval=1426658744 TSecr=1426658743"
"1320","0.000216","127.0.0.1","127.0.0.1","TCP","143","0.000051000","57042  >  8082 [PSH, ACK] Seq=1 Ack=1 Win=408256 Len=87 TSval=1426658744 TSecr=1426658744"
"1330","0.000199","127.0.0.1","127.0.0.1","TCP","143","0.000047000","57043  >  8082 [PSH, ACK] Seq=1 Ack=1 Win=408256 Len=87 TSval=1426658744 TSecr=1426658744"
"1340","15.508429","127.0.0.1","127.0.0.1","TCP","145","0.000114000","57044  >  8081 [PSH, ACK] Seq=1 Ack=1 Win=408256 Len=89 TSval=1426674198 TSecr=1426674198"
"1350","0.000237","127.0.0.1","127.0.0.1","TCP","145","0.000040000","57045  >  8081 [PSH, ACK] Seq=1 Ack=1 Win=408256 Len=89 TSval=1426674199 TSecr=1426674198"
"1360","0.000232","127.0.0.1","127.0.0.1","TCP","143","0.000040000","57046  >  8081 [PSH, ACK] Seq=1 Ack=1 Win=408256 Len=87 TSval=1426674199 TSecr=1426674199"
"1370","0.000165","127.0.0.1","127.0.0.1","TCP","143","0.000023000","57047  >  8081 [PSH, ACK] Seq=1 Ack=1 Win=408256 Len=87 TSval=1426674199 TSecr=1426674199"
"1380","0.000184","127.0.0.1","127.0.0.1","TCP","143","0.000052000","57048  >  8081 [PSH, ACK] Seq=1 Ack=1 Win=408256 Len=87 TSval=1426674199 TSecr=1426674199"
"1390","0.000268","127.0.0.1","127.0.0.1","TCP","145","0.000078000","57049  >  8082 [PSH, ACK] Seq=1 Ack=1 Win=408256 Len=89 TSval=1426674199 TSecr=1426674199"
"1404","0.000276","127.0.0.1","127.0.0.1","TCP","144","0.000133000","57050  >  8080 [PSH, ACK] Seq=1 Ack=1 Win=408256 Len=88 TSval=1426674200 TSecr=1426674199 [TCP segment of a reassembled PDU]"
"1413","0.000154","127.0.0.1","127.0.0.1","TCP","145","0.000281000","57051  >  8082 [PSH, ACK] Seq=1 Ack=1 Win=408256 Len=89 TSval=1426674200 TSecr=1426674199"
"1416","0.000107","127.0.0.1","127.0.0.1","TCP","144","0.000093000","57052  >  8080 [PSH, ACK] Seq=1 Ack=1 Win=408256 Len=88 TSval=1426674200 TSecr=1426674200 [TCP segment of a reassembled PDU]"
"1428","0.000278","127.0.0.1","127.0.0.1","TCP","142","0.000106000","57053  >  8080 [PSH, ACK] Seq=1 Ack=1 Win=408256 Len=86 TSval=1426674200 TSecr=1426674200 [TCP segment of a reassembled PDU]"
"1440","0.000218","127.0.0.1","127.0.0.1","TCP","143","0.000089000","57055  >  8080 [PSH, ACK] Seq=1 Ack=1 Win=408256 Len=87 TSval=1426674200 TSecr=1426674200 [TCP segment of a reassembled PDU]"
"1447","0.000115","127.0.0.1","127.0.0.1","TCP","143","0.000218000","57054  >  8082 [PSH, ACK] Seq=1 Ack=1 Win=408256 Len=87 TSval=1426674200 TSecr=1426674200"
"1455","0.000133","127.0.0.1","127.0.0.1","TCP","142","0.000074000","57056  >  8080 [PSH, ACK] Seq=1 Ack=1 Win=408256 Len=86 TSval=1426674201 TSecr=1426674201 [TCP segment of a reassembled PDU]"
"1470","0.000240","127.0.0.1","127.0.0.1","TCP","143","0.000191000","57057  >  8082 [PSH, ACK] Seq=1 Ack=1 Win=408256 Len=87 TSval=1426674201 TSecr=1426674201"
"1474","0.000038","127.0.0.1","127.0.0.1","TCP","144","0.000138000","57058  >  8082 [PSH, ACK] Seq=1 Ack=1 Win=408256 Len=88 TSval=1426674201 TSecr=1426674201"
"1486","0.000291","127.0.0.1","127.0.0.1","TCP","144","0.000122000","57059  >  8082 [PSH, ACK] Seq=1 Ack=1 Win=408256 Len=88 TSval=1426674201 TSecr=1426674201"
"1506","0.000552","127.0.0.1","127.0.0.1","TCP","142","0.000405000","57061  >  8082 [PSH, ACK] Seq=1 Ack=1 Win=408256 Len=86 TSval=1426674202 TSecr=1426674201"
"1511","0.000122","127.0.0.1","127.0.0.1","TCP","143","0.000792000","57060  >  8082 [PSH, ACK] Seq=1 Ack=1 Win=408256 Len=87 TSval=1426674202 TSecr=1426674201"
"1522","0.000376","127.0.0.1","127.0.0.1","TCP","143","0.000294000","57062  >  8082 [PSH, ACK] Seq=1 Ack=1 Win=408256 Len=87 TSval=1426674202 TSecr=1426674202"
"1530","0.000191","127.0.0.1","127.0.0.1","TCP","144","0.000256000","57063  >  8080 [PSH, ACK] Seq=1 Ack=1 Win=408256 Len=88 TSval=1426674202 TSecr=1426674202 [TCP segment of a reassembled PDU]"
"1540","0.000221","127.0.0.1","127.0.0.1","TCP","142","0.000266000","57064  >  8082 [PSH, ACK] Seq=1 Ack=1 Win=408256 Len=86 TSval=1426674203 TSecr=1426674202"
"1546","0.000113","127.0.0.1","127.0.0.1","TCP","141","0.000166000","57065  >  8080 [PSH, ACK] Seq=1 Ack=1 Win=408256 Len=85 TSval=1426674203 TSecr=1426674203 [TCP segment of a reassembled PDU]"
"1554","0.000292","127.0.0.1","127.0.0.1","TCP","144","0.000050000","57066  >  8080 [PSH, ACK] Seq=1 Ack=1 Win=408256 Len=88 TSval=1426674203 TSecr=1426674203 [TCP segment of a reassembled PDU]"
"1564","0.000218","127.0.0.1","127.0.0.1","TCP","144","0.000044000","57067  >  8080 [PSH, ACK] Seq=1 Ack=1 Win=408256 Len=88 TSval=1426674203 TSecr=1426674203 [TCP segment of a reassembled PDU]"
"1576","0.001895","127.0.0.1","127.0.0.1","TCP","143","0.001708000","57068  >  8080 [PSH, ACK] Seq=1 Ack=1 Win=408256 Len=87 TSval=1426674205 TSecr=1426674203 [TCP segment of a reassembled PDU]"
"1584","0.000275","127.0.0.1","127.0.0.1","TCP","144","0.000043000","57069  >  8081 [PSH, ACK] Seq=1 Ack=1 Win=408256 Len=88 TSval=1426674205 TSecr=1426674205"
"1594","0.000165","127.0.0.1","127.0.0.1","TCP","141","0.000026000","57070  >  8081 [PSH, ACK] Seq=1 Ack=1 Win=408256 Len=85 TSval=1426674205 TSecr=1426674205"
"1604","0.000184","127.0.0.1","127.0.0.1","TCP","144","0.000047000","57071  >  8081 [PSH, ACK] Seq=1 Ack=1 Win=408256 Len=88 TSval=1426674205 TSecr=1426674205"
"1614","0.000157","127.0.0.1","127.0.0.1","TCP","144","0.000032000","57072  >  8081 [PSH, ACK] Seq=1 Ack=1 Win=408256 Len=88 TSval=1426674205 TSecr=1426674205"
"1624","0.000154","127.0.0.1","127.0.0.1","TCP","143","0.000032000","57073  >  8081 [PSH, ACK] Seq=1 Ack=1 Win=408256 Len=87 TSval=1426674205 TSecr=1426674205"
"1640","0.000956","127.0.0.1","127.0.0.1","TCP","144","0.000049000","57074  >  8080 [PSH, ACK] Seq=1 Ack=1 Win=408256 Len=88 TSval=1426674206 TSecr=1426674206 [TCP segment of a reassembled PDU]"
"1650","0.000205","127.0.0.1","127.0.0.1","TCP","141","0.000038000","57075  >  8080 [PSH, ACK] Seq=1 Ack=1 Win=408256 Len=85 TSval=1426674207 TSecr=1426674207 [TCP segment of a reassembled PDU]"
"1660","0.000204","127.0.0.1","127.0.0.1","TCP","144","0.000038000","57076  >  8080 [PSH, ACK] Seq=1 Ack=1 Win=408256 Len=88 TSval=1426674207 TSecr=1426674207 [TCP segment of a reassembled PDU]"
"1670","0.000218","127.0.0.1","127.0.0.1","TCP","144","0.000048000","57077  >  8080 [PSH, ACK] Seq=1 Ack=1 Win=408256 Len=88 TSval=1426674207 TSecr=1426674207 [TCP segment of a reassembled PDU]"
"1680","0.000217","127.0.0.1","127.0.0.1","TCP","144","0.000044000","57078  >  8081 [PSH, ACK] Seq=1 Ack=1 Win=408256 Len=88 TSval=1426674207 TSecr=1426674207"
"1690","0.000185","127.0.0.1","127.0.0.1","TCP","141","0.000040000","57079  >  8081 [PSH, ACK] Seq=1 Ack=1 Win=408256 Len=85 TSval=1426674207 TSecr=1426674207"
"1700","0.000170","127.0.0.1","127.0.0.1","TCP","144","0.000044000","57080  >  8081 [PSH, ACK] Seq=1 Ack=1 Win=408256 Len=88 TSval=1426674208 TSecr=1426674208"
"1710","0.000190","127.0.0.1","127.0.0.1","TCP","144","0.000028000","57081  >  8081 [PSH, ACK] Seq=1 Ack=1 Win=408256 Len=88 TSval=1426674208 TSecr=1426674208"
"1722","18.926884","127.0.0.1","127.0.0.1","TCP","143","0.000091000","57082  >  8081 [PSH, ACK] Seq=1 Ack=1 Win=408256 Len=87 TSval=1426693055 TSecr=1426693055"
"1732","0.000243","127.0.0.1","127.0.0.1","TCP","143","0.000042000","57083  >  8081 [PSH, ACK] Seq=1 Ack=1 Win=408256 Len=87 TSval=1426693055 TSecr=1426693055"
"1742","0.000205","127.0.0.1","127.0.0.1","TCP","143","0.000050000","57084  >  8081 [PSH, ACK] Seq=1 Ack=1 Win=408256 Len=87 TSval=1426693055 TSecr=1426693055"
"1753","0.000239","127.0.0.1","127.0.0.1","TCP","144","0.000091000","57085  >  8081 [PSH, ACK] Seq=1 Ack=1 Win=408256 Len=88 TSval=1426693056 TSecr=1426693056"
"1766","0.000297","127.0.0.1","127.0.0.1","TCP","143","0.000118000","57086  >  8082 [PSH, ACK] Seq=1 Ack=1 Win=408256 Len=87 TSval=1426693056 TSecr=1426693056"
"1776","0.000217","127.0.0.1","127.0.0.1","TCP","144","0.000270000","57087  >  8080 [PSH, ACK] Seq=1 Ack=1 Win=408256 Len=88 TSval=1426693056 TSecr=1426693056 [TCP segment of a reassembled PDU]"
"1788","0.000350","127.0.0.1","127.0.0.1","TCP","142","0.000050000","57089  >  8080 [PSH, ACK] Seq=1 Ack=1 Win=408256 Len=86 TSval=1426693056 TSecr=1426693056 [TCP segment of a reassembled PDU]"
"1789","0.000000","127.0.0.1","127.0.0.1","TCP","143","0.000403000","57088  >  8082 [PSH, ACK] Seq=1 Ack=1 Win=408256 Len=87 TSval=1426693056 TSecr=1426693056"
"1810","0.000406","127.0.0.1","127.0.0.1","TCP","143","0.000228000","57090  >  8082 [PSH, ACK] Seq=1 Ack=1 Win=408256 Len=87 TSval=1426693057 TSecr=1426693057"
"1814","0.000071","127.0.0.1","127.0.0.1","TCP","143","0.000295000","57091  >  8080 [PSH, ACK] Seq=1 Ack=1 Win=408256 Len=87 TSval=1426693057 TSecr=1426693057 [TCP segment of a reassembled PDU]"
"1828","0.000370","127.0.0.1","127.0.0.1","TCP","144","0.000220000","57092  >  8082 [PSH, ACK] Seq=1 Ack=1 Win=408256 Len=88 TSval=1426693057 TSecr=1426693057"
"1832","0.000094","127.0.0.1","127.0.0.1","TCP","142","0.000308000","57093  >  8080 [PSH, ACK] Seq=1 Ack=1 Win=408256 Len=86 TSval=1426693057 TSecr=1426693057 [TCP segment of a reassembled PDU]"
"1842","0.000464","127.0.0.1","127.0.0.1","TCP","144","0.000108000","57094  >  8080 [PSH, ACK] Seq=1 Ack=1 Win=408256 Len=88 TSval=1426693058 TSecr=1426693058 [TCP segment of a reassembled PDU]"
"1854","0.000189","127.0.0.1","127.0.0.1","TCP","141","0.000035000","57095  >  8080 [PSH, ACK] Seq=1 Ack=1 Win=408256 Len=85 TSval=1426693058 TSecr=1426693058 [TCP segment of a reassembled PDU]"
"1865","0.000227","127.0.0.1","127.0.0.1","TCP","144","0.000246000","57096  >  8082 [PSH, ACK] Seq=1 Ack=1 Win=408256 Len=88 TSval=1426693058 TSecr=1426693058"
"1876","0.000179","127.0.0.1","127.0.0.1","TCP","144","0.000227000","57097  >  8080 [PSH, ACK] Seq=1 Ack=1 Win=408256 Len=88 TSval=1426693058 TSecr=1426693058 [TCP segment of a reassembled PDU]"
"1880","0.000034","127.0.0.1","127.0.0.1","TCP","142","0.000049000","57098  >  8082 [PSH, ACK] Seq=1 Ack=1 Win=408256 Len=86 TSval=1426693058 TSecr=1426693058"
"1892","0.000270","127.0.0.1","127.0.0.1","TCP","143","0.000056000","57099  >  8082 [PSH, ACK] Seq=1 Ack=1 Win=408256 Len=87 TSval=1426693059 TSecr=1426693059"
"1896","0.000035","127.0.0.1","127.0.0.1","TCP","144","0.000086000","57100  >  8080 [PSH, ACK] Seq=1 Ack=1 Win=408256 Len=88 TSval=1426693059 TSecr=1426693059 [TCP segment of a reassembled PDU]"
"1910","0.000291","127.0.0.1","127.0.0.1","TCP","142","0.000065000","57102  >  8082 [PSH, ACK] Seq=1 Ack=1 Win=408256 Len=86 TSval=1426693059 TSecr=1426693059"
"1920","0.000136","127.0.0.1","127.0.0.1","TCP","143","0.000196000","57101  >  8080 [PSH, ACK] Seq=1 Ack=1 Win=408256 Len=87 TSval=1426693059 TSecr=1426693059 [TCP segment of a reassembled PDU]"
"1924","0.000062","127.0.0.1","127.0.0.1","TCP","144","0.000064000","57103  >  8082 [PSH, ACK] Seq=1 Ack=1 Win=408256 Len=88 TSval=1426693059 TSecr=1426693059"
"1932","0.000124","127.0.0.1","127.0.0.1","TCP","141","0.000050000","57104  >  8081 [PSH, ACK] Seq=1 Ack=1 Win=408256 Len=85 TSval=1426693059 TSecr=1426693059"
"1940","0.000173","127.0.0.1","127.0.0.1","TCP","144","0.000036000","57105  >  8081 [PSH, ACK] Seq=1 Ack=1 Win=408256 Len=88 TSval=1426693060 TSecr=1426693059"
"1954","0.000400","127.0.0.1","127.0.0.1","TCP","144","0.000259000","57106  >  8081 [PSH, ACK] Seq=1 Ack=1 Win=408256 Len=88 TSval=1426693060 TSecr=1426693060"
"1962","0.000249","127.0.0.1","127.0.0.1","TCP","143","0.000047000","57107  >  8081 [PSH, ACK] Seq=1 Ack=1 Win=408256 Len=87 TSval=1426693060 TSecr=1426693060"
"1976","0.000390","127.0.0.1","127.0.0.1","TCP","144","0.000103000","57108  >  8080 [PSH, ACK] Seq=1 Ack=1 Win=408256 Len=88 TSval=1426693061 TSecr=1426693060 [TCP segment of a reassembled PDU]"
"1992","0.000413","127.0.0.1","127.0.0.1","TCP","142","0.000258000","57109  >  8080 [PSH, ACK] Seq=1 Ack=1 Win=408256 Len=86 TSval=1426693061 TSecr=1426693061 [TCP segment of a reassembled PDU]"
"2002","0.000223","127.0.0.1","127.0.0.1","TCP","143","0.000043000","57110  >  8080 [PSH, ACK] Seq=1 Ack=1 Win=408256 Len=87 TSval=1426693061 TSecr=1426693061 [TCP segment of a reassembled PDU]"
"2012","0.000189","127.0.0.1","127.0.0.1","TCP","142","0.000046000","57111  >  8080 [PSH, ACK] Seq=1 Ack=1 Win=408256 Len=86 TSval=1426693061 TSecr=1426693061 [TCP segment of a reassembled PDU]"
"2022","0.000233","127.0.0.1","127.0.0.1","TCP","144","0.000047000","57112  >  8082 [PSH, ACK] Seq=1 Ack=1 Win=408256 Len=88 TSval=1426693062 TSecr=1426693062"
"2032","0.000169","127.0.0.1","127.0.0.1","TCP","142","0.000033000","57113  >  8082 [PSH, ACK] Seq=1 Ack=1 Win=408256 Len=86 TSval=1426693062 TSecr=1426693062"
"2042","0.000183","127.0.0.1","127.0.0.1","TCP","143","0.000043000","57114  >  8082 [PSH, ACK] Seq=1 Ack=1 Win=408256 Len=87 TSval=1426693062 TSecr=1426693062"
"2052","0.000222","127.0.0.1","127.0.0.1","TCP","142","0.000044000","57115  >  8082 [PSH, ACK] Seq=1 Ack=1 Win=408256 Len=86 TSval=1426693062 TSecr=1426693062"
"2062","11.178030","127.0.0.1","127.0.0.1","TCP","143","0.000127000","57116  >  8081 [PSH, ACK] Seq=1 Ack=1 Win=408256 Len=87 TSval=1426704201 TSecr=1426704201"
"2072","0.000382","127.0.0.1","127.0.0.1","TCP","143","0.000058000","57117  >  8081 [PSH, ACK] Seq=1 Ack=1 Win=408256 Len=87 TSval=1426704201 TSecr=1426704201"
"2082","0.000316","127.0.0.1","127.0.0.1","TCP","144","0.000116000","57118  >  8081 [PSH, ACK] Seq=1 Ack=1 Win=408256 Len=88 TSval=1426704202 TSecr=1426704201"
"2092","0.000204","127.0.0.1","127.0.0.1","TCP","144","0.000047000","57119  >  8081 [PSH, ACK] Seq=1 Ack=1 Win=408256 Len=88 TSval=1426704202 TSecr=1426704202"
"2102","0.000204","127.0.0.1","127.0.0.1","TCP","143","0.000050000","57120  >  8082 [PSH, ACK] Seq=1 Ack=1 Win=408256 Len=87 TSval=1426704202 TSecr=1426704202"
"2116","0.000300","127.0.0.1","127.0.0.1","TCP","142","0.000157000","57121  >  8080 [PSH, ACK] Seq=1 Ack=1 Win=408256 Len=86 TSval=1426704202 TSecr=1426704202 [TCP segment of a reassembled PDU]"
"2124","0.000160","127.0.0.1","127.0.0.1","TCP","143","0.000314000","57122  >  8082 [PSH, ACK] Seq=1 Ack=1 Win=408256 Len=87 TSval=1426704202 TSecr=1426704202"
"2135","0.000222","127.0.0.1","127.0.0.1","TCP","143","0.000191000","57123  >  8080 [PSH, ACK] Seq=1 Ack=1 Win=408256 Len=87 TSval=1426704203 TSecr=1426704202 [TCP segment of a reassembled PDU]"
"2146","0.000259","127.0.0.1","127.0.0.1","TCP","142","0.000108000","57125  >  8080 [PSH, ACK] Seq=1 Ack=1 Win=408256 Len=86 TSval=1426704203 TSecr=1426704203 [TCP segment of a reassembled PDU]"
"2158","0.000301","127.0.0.1","127.0.0.1","TCP","143","0.000127000","57126  >  8080 [PSH, ACK] Seq=1 Ack=1 Win=408256 Len=87 TSval=1426704203 TSecr=1426704203 [TCP segment of a reassembled PDU]"
"2168","0.000243","127.0.0.1","127.0.0.1","TCP","144","0.000886000","57124  >  8082 [PSH, ACK] Seq=1 Ack=1 Win=408256 Len=88 TSval=1426704203 TSecr=1426704203"
"2176","0.000172","127.0.0.1","127.0.0.1","TCP","142","0.000194000","57127  >  8082 [PSH, ACK] Seq=1 Ack=1 Win=408256 Len=86 TSval=1426704204 TSecr=1426704203"
"2184","0.000156","127.0.0.1","127.0.0.1","TCP","144","0.000198000","57128  >  8082 [PSH, ACK] Seq=1 Ack=1 Win=408256 Len=88 TSval=1426704204 TSecr=1426704204"
"2188","0.000100","127.0.0.1","127.0.0.1","TCP","143","0.000105000","57129  >  8082 [PSH, ACK] Seq=1 Ack=1 Win=408256 Len=87 TSval=1426704204 TSecr=1426704204"
"2199","0.000265","127.0.0.1","127.0.0.1","TCP","142","0.000095000","57130  >  8082 [PSH, ACK] Seq=1 Ack=1 Win=408256 Len=86 TSval=1426704204 TSecr=1426704204"
"2212","0.000233","127.0.0.1","127.0.0.1","TCP","143","0.000054000","57131  >  8082 [PSH, ACK] Seq=1 Ack=1 Win=408256 Len=87 TSval=1426704204 TSecr=1426704204"
"2216","0.000021","127.0.0.1","127.0.0.1","TCP","141","0.000070000","57132  >  8080 [PSH, ACK] Seq=1 Ack=1 Win=408256 Len=85 TSval=1426704204 TSecr=1426704204 [TCP segment of a reassembled PDU]"
"2224","0.000145","127.0.0.1","127.0.0.1","TCP","144","0.000039000","57133  >  8080 [PSH, ACK] Seq=1 Ack=1 Win=408256 Len=88 TSval=1426704204 TSecr=1426704204 [TCP segment of a reassembled PDU]"
"2234","0.000170","127.0.0.1","127.0.0.1","TCP","144","0.000029000","57134  >  8080 [PSH, ACK] Seq=1 Ack=1 Win=408256 Len=88 TSval=1426704205 TSecr=1426704205 [TCP segment of a reassembled PDU]"
"2244","0.000194","127.0.0.1","127.0.0.1","TCP","143","0.000043000","57135  >  8080 [PSH, ACK] Seq=1 Ack=1 Win=408256 Len=87 TSval=1426704205 TSecr=1426704205 [TCP segment of a reassembled PDU]"
"2256","0.000199","127.0.0.1","127.0.0.1","TCP","144","0.000053000","57136  >  8080 [PSH, ACK] Seq=1 Ack=1 Win=408256 Len=88 TSval=1426704205 TSecr=1426704205 [TCP segment of a reassembled PDU]"
"2266","0.000198","127.0.0.1","127.0.0.1","TCP","141","0.000056000","57137  >  8081 [PSH, ACK] Seq=1 Ack=1 Win=408256 Len=85 TSval=1426704205 TSecr=1426704205"
"2276","0.000835","127.0.0.1","127.0.0.1","TCP","144","0.000501000","57138  >  8081 [PSH, ACK] Seq=1 Ack=1 Win=408256 Len=88 TSval=1426704206 TSecr=1426704206"
"2288","0.000364","127.0.0.1","127.0.0.1","TCP","144","0.000119000","57139  >  8081 [PSH, ACK] Seq=1 Ack=1 Win=408256 Len=88 TSval=1426704206 TSecr=1426704206"
"2296","0.000320","127.0.0.1","127.0.0.1","TCP","143","0.000054000","57140  >  8081 [PSH, ACK] Seq=1 Ack=1 Win=408256 Len=87 TSval=1426704207 TSecr=1426704207"
"2306","0.000288","127.0.0.1","127.0.0.1","TCP","144","0.000102000","57141  >  8081 [PSH, ACK] Seq=1 Ack=1 Win=408256 Len=88 TSval=1426704207 TSecr=1426704207"
"2322","0.000708","127.0.0.1","127.0.0.1","TCP","141","0.000048000","57142  >  8080 [PSH, ACK] Seq=1 Ack=1 Win=408256 Len=85 TSval=1426704208 TSecr=1426704208 [TCP segment of a reassembled PDU]"
"2332","0.000194","127.0.0.1","127.0.0.1","TCP","144","0.000039000","57143  >  8080 [PSH, ACK] Seq=1 Ack=1 Win=408256 Len=88 TSval=1426704208 TSecr=1426704208 [TCP segment of a reassembled PDU]"
"2342","0.000317","127.0.0.1","127.0.0.1","TCP","144","0.000088000","57144  >  8080 [PSH, ACK] Seq=1 Ack=1 Win=408256 Len=88 TSval=1426704208 TSecr=1426704208 [TCP segment of a reassembled PDU]"
"2352","0.000207","127.0.0.1","127.0.0.1","TCP","143","0.000060000","57145  >  8080 [PSH, ACK] Seq=1 Ack=1 Win=408256 Len=87 TSval=1426704208 TSecr=1426704208 [TCP segment of a reassembled PDU]"
"2362","0.000340","127.0.0.1","127.0.0.1","TCP","141","0.000205000","57146  >  8081 [PSH, ACK] Seq=1 Ack=1 Win=408256 Len=85 TSval=1426704209 TSecr=1426704209"
"2374","0.000487","127.0.0.1","127.0.0.1","TCP","144","0.000318000","57147  >  8081 [PSH, ACK] Seq=1 Ack=1 Win=408256 Len=88 TSval=1426704209 TSecr=1426704209"
"2384","0.002055","127.0.0.1","127.0.0.1","TCP","144","0.001900000","57148  >  8081 [PSH, ACK] Seq=1 Ack=1 Win=408256 Len=88 TSval=1426704211 TSecr=1426704209"
"2392","0.000284","127.0.0.1","127.0.0.1","TCP","143","0.000053000","57149  >  8081 [PSH, ACK] Seq=1 Ack=1 Win=408256 Len=87 TSval=1426704211 TSecr=1426704211"
"2402","6.064719","127.0.0.1","127.0.0.1","TCP","143","0.000173000","57150  >  8080 [PSH, ACK] Seq=1 Ack=1 Win=408256 Len=87 TSval=1426710255 TSecr=1426710255 [TCP segment of a reassembled PDU]"
"2412","0.000381","127.0.0.1","127.0.0.1","TCP","142","0.000045000","57151  >  8080 [PSH, ACK] Seq=1 Ack=1 Win=408256 Len=86 TSval=1426710256 TSecr=1426710255 [TCP segment of a reassembled PDU]"
"2422","0.000291","127.0.0.1","127.0.0.1","TCP","143","0.000065000","57152  >  8080 [PSH, ACK] Seq=1 Ack=1 Win=408256 Len=87 TSval=1426710256 TSecr=1426710256 [TCP segment of a reassembled PDU]"
"2431","0.000264","127.0.0.1","127.0.0.1","TCP","142","0.000132000","57153  >  8080 [PSH, ACK] Seq=1 Ack=1 Win=408256 Len=86 TSval=1426710256 TSecr=1426710256 [TCP segment of a reassembled PDU]"
"2446","0.000380","127.0.0.1","127.0.0.1","TCP","143","0.000149000","57154  >  8082 [PSH, ACK] Seq=1 Ack=1 Win=408256 Len=87 TSval=1426710256 TSecr=1426710256"
"2447","0.000012","127.0.0.1","127.0.0.1","TCP","143","0.000066000","57155  >  8081 [PSH, ACK] Seq=1 Ack=1 Win=408256 Len=87 TSval=1426710256 TSecr=1426710256"
"2466","0.000591","127.0.0.1","127.0.0.1","TCP","142","0.000059000","57156  >  8082 [PSH, ACK] Seq=1 Ack=1 Win=408256 Len=86 TSval=1426710257 TSecr=1426710257"
"2467","0.000006","127.0.0.1","127.0.0.1","TCP","143","0.000071000","57157  >  8081 [PSH, ACK] Seq=1 Ack=1 Win=408256 Len=87 TSval=1426710257 TSecr=1426710257"
"2488","0.000506","127.0.0.1","127.0.0.1","TCP","144","0.000316000","57158  >  8081 [PSH, ACK] Seq=1 Ack=1 Win=408256 Len=88 TSval=1426710258 TSecr=1426710257"
"2498","0.000224","127.0.0.1","127.0.0.1","TCP","144","0.000067000","57160  >  8081 [PSH, ACK] Seq=1 Ack=1 Win=408256 Len=88 TSval=1426710258 TSecr=1426710258"
"2502","0.000040","127.0.0.1","127.0.0.1","TCP","143","0.000575000","57159  >  8082 [PSH, ACK] Seq=1 Ack=1 Win=408256 Len=87 TSval=1426710258 TSecr=1426710257"
"2518","0.000410","127.0.0.1","127.0.0.1","TCP","141","0.000276000","57161  >  8081 [PSH, ACK] Seq=1 Ack=1 Win=408256 Len=85 TSval=1426710258 TSecr=1426710258"
"2523","0.000114","127.0.0.1","127.0.0.1","TCP","142","0.000376000","57162  >  8082 [PSH, ACK] Seq=1 Ack=1 Win=408256 Len=86 TSval=1426710258 TSecr=1426710258"
"2532","0.000260","127.0.0.1","127.0.0.1","TCP","143","0.000155000","57163  >  8082 [PSH, ACK] Seq=1 Ack=1 Win=408256 Len=87 TSval=1426710259 TSecr=1426710258"
"2544","0.000352","127.0.0.1","127.0.0.1","TCP","143","0.000153000","57165  >  8082 [PSH, ACK] Seq=1 Ack=1 Win=408256 Len=87 TSval=1426710259 TSecr=1426710259"
"2548","0.000084","127.0.0.1","127.0.0.1","TCP","144","0.000233000","57164  >  8080 [PSH, ACK] Seq=1 Ack=1 Win=408256 Len=88 TSval=1426710259 TSecr=1426710259 [TCP segment of a reassembled PDU]"
"2557","0.000185","127.0.0.1","127.0.0.1","TCP","144","0.000079000","57166  >  8082 [PSH, ACK] Seq=1 Ack=1 Win=408256 Len=88 TSval=1426710259 TSecr=1426710259"
"2564","0.000066","127.0.0.1","127.0.0.1","TCP","144","0.000042000","57167  >  8080 [PSH, ACK] Seq=1 Ack=1 Win=408256 Len=88 TSval=1426710259 TSecr=1426710259 [TCP segment of a reassembled PDU]"
"2576","0.000242","127.0.0.1","127.0.0.1","TCP","144","0.000057000","57168  >  8082 [PSH, ACK] Seq=1 Ack=1 Win=408256 Len=88 TSval=1426710260 TSecr=1426710259"
"2580","0.000070","127.0.0.1","127.0.0.1","TCP","143","0.000124000","57169  >  8080 [PSH, ACK] Seq=1 Ack=1 Win=408256 Len=87 TSval=1426710260 TSecr=1426710259 [TCP segment of a reassembled PDU]"
"2592","0.000202","127.0.0.1","127.0.0.1","TCP","141","0.000113000","57170  >  8082 [PSH, ACK] Seq=1 Ack=1 Win=408256 Len=85 TSval=1426710260 TSecr=1426710260"
"2596","0.000105","127.0.0.1","127.0.0.1","TCP","142","0.000158000","57171  >  8080 [PSH, ACK] Seq=1 Ack=1 Win=408256 Len=86 TSval=1426710260 TSecr=1426710260 [TCP segment of a reassembled PDU]"
"2612","0.000482","127.0.0.1","127.0.0.1","TCP","144","0.000341000","57172  >  8081 [PSH, ACK] Seq=1 Ack=1 Win=408256 Len=88 TSval=1426710260 TSecr=1426710260"
"2622","0.000222","127.0.0.1","127.0.0.1","TCP","144","0.000041000","57173  >  8081 [PSH, ACK] Seq=1 Ack=1 Win=408256 Len=88 TSval=1426710261 TSecr=1426710261"
"2632","0.000200","127.0.0.1","127.0.0.1","TCP","143","0.000062000","57174  >  8081 [PSH, ACK] Seq=1 Ack=1 Win=408256 Len=87 TSval=1426710261 TSecr=1426710261"
"2644","0.000361","127.0.0.1","127.0.0.1","TCP","142","0.000233000","57175  >  8081 [PSH, ACK] Seq=1 Ack=1 Win=408256 Len=86 TSval=1426710261 TSecr=1426710261"
"2662","0.000867","127.0.0.1","127.0.0.1","TCP","144","0.000046000","57176  >  8080 [PSH, ACK] Seq=1 Ack=1 Win=408256 Len=88 TSval=1426710262 TSecr=1426710262 [TCP segment of a reassembled PDU]"
"2672","0.000184","127.0.0.1","127.0.0.1","TCP","144","0.000037000","57177  >  8080 [PSH, ACK] Seq=1 Ack=1 Win=408256 Len=88 TSval=1426710262 TSecr=1426710262 [TCP segment of a reassembled PDU]"
"2682","0.000175","127.0.0.1","127.0.0.1","TCP","143","0.000033000","57178  >  8080 [PSH, ACK] Seq=1 Ack=1 Win=408256 Len=87 TSval=1426710262 TSecr=1426710262 [TCP segment of a reassembled PDU]"
"2692","0.000168","127.0.0.1","127.0.0.1","TCP","144","0.000043000","57179  >  8081 [PSH, ACK] Seq=1 Ack=1 Win=408256 Len=88 TSval=1426710263 TSecr=1426710262"
"2702","0.000200","127.0.0.1","127.0.0.1","TCP","144","0.000044000","57180  >  8081 [PSH, ACK] Seq=1 Ack=1 Win=408256 Len=88 TSval=1426710263 TSecr=1426710263"
"2712","0.000150","127.0.0.1","127.0.0.1","TCP","143","0.000032000","57181  >  8081 [PSH, ACK] Seq=1 Ack=1 Win=408256 Len=87 TSval=1426710263 TSecr=1426710263"
"2734","5.576873","127.0.0.1","127.0.0.1","TCP","143","0.000098000","57182  >  8080 [PSH, ACK] Seq=1 Ack=1 Win=408256 Len=87 TSval=1426715819 TSecr=1426715819 [TCP segment of a reassembled PDU]"
"2744","0.000208","127.0.0.1","127.0.0.1","TCP","142","0.000030000","57183  >  8080 [PSH, ACK] Seq=1 Ack=1 Win=408256 Len=86 TSval=1426715819 TSecr=1426715819 [TCP segment of a reassembled PDU]"
"2754","0.000226","127.0.0.1","127.0.0.1","TCP","143","0.000048000","57184  >  8080 [PSH, ACK] Seq=1 Ack=1 Win=408256 Len=87 TSval=1426715819 TSecr=1426715819 [TCP segment of a reassembled PDU]"
"2764","0.000239","127.0.0.1","127.0.0.1","TCP","142","0.000054000","57185  >  8080 [PSH, ACK] Seq=1 Ack=1 Win=408256 Len=86 TSval=1426715820 TSecr=1426715820 [TCP segment of a reassembled PDU]"
"2774","0.000268","127.0.0.1","127.0.0.1","TCP","143","0.000078000","57186  >  8080 [PSH, ACK] Seq=1 Ack=1 Win=408256 Len=87 TSval=1426715820 TSecr=1426715820 [TCP segment of a reassembled PDU]"
"2784","0.000222","127.0.0.1","127.0.0.1","TCP","143","0.000049000","57187  >  8082 [PSH, ACK] Seq=1 Ack=1 Win=408256 Len=87 TSval=1426715820 TSecr=1426715820"
"2798","0.000183","127.0.0.1","127.0.0.1","TCP","143","0.000099000","57188  >  8081 [PSH, ACK] Seq=1 Ack=1 Win=408256 Len=87 TSval=1426715820 TSecr=1426715820"
"2810","0.000311","127.0.0.1","127.0.0.1","TCP","144","0.000167000","57190  >  8081 [PSH, ACK] Seq=1 Ack=1 Win=408256 Len=88 TSval=1426715821 TSecr=1426715820"
"2818","0.000223","127.0.0.1","127.0.0.1","TCP","144","0.000050000","57191  >  8081 [PSH, ACK] Seq=1 Ack=1 Win=408256 Len=88 TSval=1426715821 TSecr=1426715821"
"2821","0.000021","127.0.0.1","127.0.0.1","TCP","142","0.000607000","57189  >  8082 [PSH, ACK] Seq=1 Ack=1 Win=408256 Len=86 TSval=1426715821 TSecr=1426715820"
"2840","0.000396","127.0.0.1","127.0.0.1","TCP","141","0.000232000","57192  >  8081 [PSH, ACK] Seq=1 Ack=1 Win=408256 Len=85 TSval=1426715821 TSecr=1426715821"
"2850","0.000232","127.0.0.1","127.0.0.1","TCP","143","0.000047000","57194  >  8081 [PSH, ACK] Seq=1 Ack=1 Win=408256 Len=87 TSval=1426715821 TSecr=1426715821"
"2851","0.000001","127.0.0.1","127.0.0.1","TCP","143","0.000451000","57193  >  8082 [PSH, ACK] Seq=1 Ack=1 Win=408256 Len=87 TSval=1426715821 TSecr=1426715821"
"2870","0.000447","127.0.0.1","127.0.0.1","TCP","142","0.000272000","57196  >  8082 [PSH, ACK] Seq=1 Ack=1 Win=408256 Len=86 TSval=1426715822 TSecr=1426715822"
"2874","0.000217","127.0.0.1","127.0.0.1","TCP","143","0.000485000","57195  >  8082 [PSH, ACK] Seq=1 Ack=1 Win=408256 Len=87 TSval=1426715822 TSecr=1426715822"
"2886","0.000294","127.0.0.1","127.0.0.1","TCP","143","0.000168000","57197  >  8082 [PSH, ACK] Seq=1 Ack=1 Win=408256 Len=87 TSval=1426715822 TSecr=1426715822"
"2892","0.000163","127.0.0.1","127.0.0.1","TCP","144","0.000325000","57198  >  8082 [PSH, ACK] Seq=1 Ack=1 Win=408256 Len=88 TSval=1426715822 TSecr=1426715822"
"2905","0.000336","127.0.0.1","127.0.0.1","TCP","144","0.000118000","57199  >  8082 [PSH, ACK] Seq=1 Ack=1 Win=408256 Len=88 TSval=1426715823 TSecr=1426715823"
"2914","0.000176","127.0.0.1","127.0.0.1","TCP","144","0.000173000","57200  >  8080 [PSH, ACK] Seq=1 Ack=1 Win=408256 Len=88 TSval=1426715823 TSecr=1426715823 [TCP segment of a reassembled PDU]"
"2917","0.000021","127.0.0.1","127.0.0.1","TCP","141","0.000084000","57201  >  8082 [PSH, ACK] Seq=1 Ack=1 Win=408256 Len=85 TSval=1426715823 TSecr=1426715823"
"2930","0.000187","127.0.0.1","127.0.0.1","TCP","143","0.000030000","57203  >  8082 [PSH, ACK] Seq=1 Ack=1 Win=408256 Len=87 TSval=1426715823 TSecr=1426715823"
"2933","0.000015","127.0.0.1","127.0.0.1","TCP","143","0.000051000","57202  >  8080 [PSH, ACK] Seq=1 Ack=1 Win=408256 Len=87 TSval=1426715823 TSecr=1426715823 [TCP segment of a reassembled PDU]"
"2944","0.000165","127.0.0.1","127.0.0.1","TCP","142","0.000023000","57204  >  8080 [PSH, ACK] Seq=1 Ack=1 Win=408256 Len=86 TSval=1426715823 TSecr=1426715823 [TCP segment of a reassembled PDU]"
"2954","0.000205","127.0.0.1","127.0.0.1","TCP","144","0.000063000","57205  >  8081 [PSH, ACK] Seq=1 Ack=1 Win=408256 Len=88 TSval=1426715824 TSecr=1426715824"
"2968","0.000272","127.0.0.1","127.0.0.1","TCP","143","0.000129000","57206  >  8081 [PSH, ACK] Seq=1 Ack=1 Win=408256 Len=87 TSval=1426715824 TSecr=1426715824"
"2980","0.000177","127.0.0.1","127.0.0.1","TCP","143","0.000159000","57207  >  8081 [PSH, ACK] Seq=1 Ack=1 Win=408256 Len=87 TSval=1426715824 TSecr=1426715824"
"2988","0.000123","127.0.0.1","127.0.0.1","TCP","142","0.000167000","57208  >  8081 [PSH, ACK] Seq=1 Ack=1 Win=408256 Len=86 TSval=1426715824 TSecr=1426715824"
"3004","0.000451","127.0.0.1","127.0.0.1","TCP","144","0.000457000","57209  >  8081 [PSH, ACK] Seq=1 Ack=1 Win=408256 Len=88 TSval=1426715825 TSecr=1426715824"
"3014","0.000205","127.0.0.1","127.0.0.1","TCP","144","0.000036000","57210  >  8081 [PSH, ACK] Seq=1 Ack=1 Win=408256 Len=88 TSval=1426715825 TSecr=1426715825"
"3024","0.000196","127.0.0.1","127.0.0.1","TCP","141","0.000037000","57211  >  8081 [PSH, ACK] Seq=1 Ack=1 Win=408256 Len=85 TSval=1426715825 TSecr=1426715825"
"3034","0.000214","127.0.0.1","127.0.0.1","TCP","143","0.000046000","57212  >  8082 [PSH, ACK] Seq=1 Ack=1 Win=408256 Len=87 TSval=1426715825 TSecr=1426715825"
"3044","0.000188","127.0.0.1","127.0.0.1","TCP","144","0.000040000","57213  >  8082 [PSH, ACK] Seq=1 Ack=1 Win=408256 Len=88 TSval=1426715825 TSecr=1426715825"
"3054","0.000167","127.0.0.1","127.0.0.1","TCP","144","0.000046000","57214  >  8082 [PSH, ACK] Seq=1 Ack=1 Win=408256 Len=88 TSval=1426715826 TSecr=1426715826"
"3064","0.000188","127.0.0.1","127.0.0.1","TCP","141","0.000031000","57215  >  8082 [PSH, ACK] Seq=1 Ack=1 Win=408256 Len=85 TSval=1426715826 TSecr=1426715826"
"3078","12.975110","127.0.0.1","127.0.0.1","TCP","143","0.000152000","57217  >  8080 [PSH, ACK] Seq=1 Ack=1 Win=408256 Len=87 TSval=1426728744 TSecr=1426728744 [TCP segment of a reassembled PDU]"
"3088","0.000375","127.0.0.1","127.0.0.1","TCP","142","0.000070000","57218  >  8080 [PSH, ACK] Seq=1 Ack=1 Win=408256 Len=86 TSval=1426728744 TSecr=1426728744 [TCP segment of a reassembled PDU]"
"3098","0.000282","127.0.0.1","127.0.0.1","TCP","144","0.000052000","57219  >  8080 [PSH, ACK] Seq=1 Ack=1 Win=408256 Len=88 TSval=1426728745 TSecr=1426728745 [TCP segment of a reassembled PDU]"
"3110","0.000312","127.0.0.1","127.0.0.1","TCP","143","0.000112000","57220  >  8081 [PSH, ACK] Seq=1 Ack=1 Win=408256 Len=87 TSval=1426728745 TSecr=1426728745"
"3122","0.000297","127.0.0.1","127.0.0.1","TCP","143","0.000283000","57221  >  8081 [PSH, ACK] Seq=1 Ack=1 Win=408256 Len=87 TSval=1426728745 TSecr=1426728745"
"3127","0.000093","127.0.0.1","127.0.0.1","TCP","142","0.000191000","57222  >  8081 [PSH, ACK] Seq=1 Ack=1 Win=408256 Len=86 TSval=1426728745 TSecr=1426728745"
"3144","0.000276","127.0.0.1","127.0.0.1","TCP","144","0.000127000","57223  >  8081 [PSH, ACK] Seq=1 Ack=1 Win=408256 Len=88 TSval=1426728746 TSecr=1426728746"
"3148","0.000132","127.0.0.1","127.0.0.1","TCP","144","0.000252000","57224  >  8081 [PSH, ACK] Seq=1 Ack=1 Win=408256 Len=88 TSval=1426728746 TSecr=1426728746"
"3156","0.000200","127.0.0.1","127.0.0.1","TCP","144","0.000125000","57225  >  8081 [PSH, ACK] Seq=1 Ack=1 Win=408256 Len=88 TSval=1426728746 TSecr=1426728746"
"3167","0.000277","127.0.0.1","127.0.0.1","TCP","141","0.000107000","57226  >  8081 [PSH, ACK] Seq=1 Ack=1 Win=408256 Len=85 TSval=1426728746 TSecr=1426728746"
"3178","0.000254","127.0.0.1","127.0.0.1","TCP","142","0.000142000","57227  >  8080 [PSH, ACK] Seq=1 Ack=1 Win=408256 Len=86 TSval=1426728747 TSecr=1426728746 [TCP segment of a reassembled PDU]"
"3181","0.000017","127.0.0.1","127.0.0.1","TCP","143","0.000044000","57228  >  8081 [PSH, ACK] Seq=1 Ack=1 Win=408256 Len=87 TSval=1426728747 TSecr=1426728747"
"3194","0.000278","127.0.0.1","127.0.0.1","TCP","143","0.000064000","57229  >  8080 [PSH, ACK] Seq=1 Ack=1 Win=408256 Len=87 TSval=1426728747 TSecr=1426728747 [TCP segment of a reassembled PDU]"
"3198","0.000042","127.0.0.1","127.0.0.1","TCP","143","0.000099000","57230  >  8082 [PSH, ACK] Seq=1 Ack=1 Win=408256 Len=87 TSval=1426728747 TSecr=1426728747"
"3214","0.000632","127.0.0.1","127.0.0.1","TCP","144","0.000460000","57232  >  8082 [PSH, ACK] Seq=1 Ack=1 Win=408256 Len=88 TSval=1426728748 TSecr=1426728747"
"3215","0.000007","127.0.0.1","127.0.0.1","TCP","142","0.000462000","57231  >  8080 [PSH, ACK] Seq=1 Ack=1 Win=408256 Len=86 TSval=1426728748 TSecr=1426728747 [TCP segment of a reassembled PDU]"
"3230","0.000286","127.0.0.1","127.0.0.1","TCP","143","0.000061000","57234  >  8080 [PSH, ACK] Seq=1 Ack=1 Win=408256 Len=87 TSval=1426728748 TSecr=1426728748 [TCP segment of a reassembled PDU]"
"3239","0.000157","127.0.0.1","127.0.0.1","TCP","144","0.000214000","57233  >  8082 [PSH, ACK] Seq=1 Ack=1 Win=408256 Len=88 TSval=1426728748 TSecr=1426728748"
"3244","0.000064","127.0.0.1","127.0.0.1","TCP","144","0.000063000","57235  >  8080 [PSH, ACK] Seq=1 Ack=1 Win=408256 Len=88 TSval=1426728748 TSecr=1426728748 [TCP segment of a reassembled PDU]"
"3256","0.000178","127.0.0.1","127.0.0.1","TCP","141","0.000063000","57236  >  8082 [PSH, ACK] Seq=1 Ack=1 Win=408256 Len=85 TSval=1426728748 TSecr=1426728748"
"3266","0.000214","127.0.0.1","127.0.0.1","TCP","142","0.000266000","57237  >  8082 [PSH, ACK] Seq=1 Ack=1 Win=408256 Len=86 TSval=1426728748 TSecr=1426728748"
"3276","0.000212","127.0.0.1","127.0.0.1","TCP","143","0.000266000","57238  >  8082 [PSH, ACK] Seq=1 Ack=1 Win=408256 Len=87 TSval=1426728749 TSecr=1426728748"
"3287","0.000309","127.0.0.1","127.0.0.1","TCP","143","0.000354000","57239  >  8082 [PSH, ACK] Seq=1 Ack=1 Win=408256 Len=87 TSval=1426728749 TSecr=1426728749"
"3302","0.000383","127.0.0.1","127.0.0.1","TCP","142","0.000204000","57240  >  8082 [PSH, ACK] Seq=1 Ack=1 Win=408256 Len=86 TSval=1426728749 TSecr=1426728749"
"3312","0.000202","127.0.0.1","127.0.0.1","TCP","143","0.000048000","57241  >  8082 [PSH, ACK] Seq=1 Ack=1 Win=408256 Len=87 TSval=1426728750 TSecr=1426728749"
"3322","0.000268","127.0.0.1","127.0.0.1","TCP","144","0.000052000","57242  >  8082 [PSH, ACK] Seq=1 Ack=1 Win=408256 Len=88 TSval=1426728750 TSecr=1426728750"
"3338","0.000713","127.0.0.1","127.0.0.1","TCP","142","0.000045000","57243  >  8080 [PSH, ACK] Seq=1 Ack=1 Win=408256 Len=86 TSval=1426728750 TSecr=1426728750 [TCP segment of a reassembled PDU]"
"3348","0.000201","127.0.0.1","127.0.0.1","TCP","143","0.000044000","57244  >  8080 [PSH, ACK] Seq=1 Ack=1 Win=408256 Len=87 TSval=1426728751 TSecr=1426728751 [TCP segment of a reassembled PDU]"
"3358","0.000220","127.0.0.1","127.0.0.1","TCP","142","0.000048000","57245  >  8080 [PSH, ACK] Seq=1 Ack=1 Win=408256 Len=86 TSval=1426728751 TSecr=1426728751 [TCP segment of a reassembled PDU]"
"3368","0.000205","127.0.0.1","127.0.0.1","TCP","143","0.000043000","57246  >  8080 [PSH, ACK] Seq=1 Ack=1 Win=408256 Len=87 TSval=1426728751 TSecr=1426728751 [TCP segment of a reassembled PDU]"
"3378","0.000195","127.0.0.1","127.0.0.1","TCP","142","0.000044000","57247  >  8082 [PSH, ACK] Seq=1 Ack=1 Win=408256 Len=86 TSval=1426728751 TSecr=1426728751"
"3388","0.000174","127.0.0.1","127.0.0.1","TCP","143","0.000028000","57248  >  8082 [PSH, ACK] Seq=1 Ack=1 Win=408256 Len=87 TSval=1426728751 TSecr=1426728751"
"3398","0.000182","127.0.0.1","127.0.0.1","TCP","142","0.000034000","57249  >  8082 [PSH, ACK] Seq=1 Ack=1 Win=408256 Len=86 TSval=1426728752 TSecr=1426728752"
"3408","0.000230","127.0.0.1","127.0.0.1","TCP","143","0.000045000","57250  >  8082 [PSH, ACK] Seq=1 Ack=1 Win=408256 Len=87 TSval=1426728752 TSecr=1426728752"
"3419","4.147004","127.0.0.1","127.0.0.1","TCP","143","0.000269000","57253  >  8080 [PSH, ACK] Seq=1 Ack=1 Win=408256 Len=87 TSval=1426732874 TSecr=1426732874 [TCP segment of a reassembled PDU]"
"3428","0.000211","127.0.0.1","127.0.0.1","TCP","142","0.000044000","57254  >  8080 [PSH, ACK] Seq=1 Ack=1 Win=408256 Len=86 TSval=1426732875 TSecr=1426732874 [TCP segment of a reassembled PDU]"
"3438","0.000196","127.0.0.1","127.0.0.1","TCP","144","0.000017000","57255  >  8080 [PSH, ACK] Seq=1 Ack=1 Win=408256 Len=88 TSval=1426732875 TSecr=1426732875 [TCP segment of a reassembled PDU]"
"3448","0.000219","127.0.0.1","127.0.0.1","TCP","143","0.000047000","57256  >  8080 [PSH, ACK] Seq=1 Ack=1 Win=408256 Len=87 TSval=1426732875 TSecr=1426732875 [TCP segment of a reassembled PDU]"
"3459","0.000264","127.0.0.1","127.0.0.1","TCP","143","0.000109000","57257  >  8081 [PSH, ACK] Seq=1 Ack=1 Win=408256 Len=87 TSval=1426732875 TSecr=1426732875"
"3472","0.000213","127.0.0.1","127.0.0.1","TCP","143","0.000186000","57258  >  8081 [PSH, ACK] Seq=1 Ack=1 Win=408256 Len=87 TSval=1426732875 TSecr=1426732875"
"3473","0.000010","127.0.0.1","127.0.0.1","TCP","142","0.000054000","57259  >  8081 [PSH, ACK] Seq=1 Ack=1 Win=408256 Len=86 TSval=1426732875 TSecr=1426732875"
"3490","0.000272","127.0.0.1","127.0.0.1","TCP","144","0.000061000","57260  >  8081 [PSH, ACK] Seq=1 Ack=1 Win=408256 Len=88 TSval=1426732876 TSecr=1426732876"
"3502","0.000213","127.0.0.1","127.0.0.1","TCP","144","0.000270000","57261  >  8081 [PSH, ACK] Seq=1 Ack=1 Win=408256 Len=88 TSval=1426732876 TSecr=1426732876"
"3514","0.000254","127.0.0.1","127.0.0.1","TCP","143","0.000305000","57262  >  8081 [PSH, ACK] Seq=1 Ack=1 Win=408256 Len=87 TSval=1426732876 TSecr=1426732876"
"3518","0.000030","127.0.0.1","127.0.0.1","TCP","144","0.000109000","57263  >  8081 [PSH, ACK] Seq=1 Ack=1 Win=408256 Len=88 TSval=1426732876 TSecr=1426732876"
"3526","0.000224","127.0.0.1","127.0.0.1","TCP","141","0.000045000","57264  >  8081 [PSH, ACK] Seq=1 Ack=1 Win=408256 Len=85 TSval=1426732876 TSecr=1426732876"
"3538","0.000242","127.0.0.1","127.0.0.1","TCP","142","0.000077000","57265  >  8080 [PSH, ACK] Seq=1 Ack=1 Win=408256 Len=86 TSval=1426732877 TSecr=1426732877 [TCP segment of a reassembled PDU]"
"3546","0.000296","127.0.0.1","127.0.0.1","TCP","143","0.000048000","57267  >  8080 [PSH, ACK] Seq=1 Ack=1 Win=408256 Len=87 TSval=1426732877 TSecr=1426732877 [TCP segment of a reassembled PDU]"
"3547","0.000001","127.0.0.1","127.0.0.1","TCP","143","0.000371000","57266  >  8081 [PSH, ACK] Seq=1 Ack=1 Win=408256 Len=87 TSval=1426732877 TSecr=1426732877"
"3562","0.000270","127.0.0.1","127.0.0.1","TCP","142","0.000055000","57268  >  8080 [PSH, ACK] Seq=1 Ack=1 Win=408256 Len=86 TSval=1426732877 TSecr=1426732877 [TCP segment of a reassembled PDU]"
"3563","0.000002","127.0.0.1","127.0.0.1","TCP","143","0.000053000","57269  >  8081 [PSH, ACK] Seq=1 Ack=1 Win=408256 Len=87 TSval=1426732877 TSecr=1426732877"
"3578","0.000288","127.0.0.1","127.0.0.1","TCP","143","0.000050000","57270  >  8082 [PSH, ACK] Seq=1 Ack=1 Win=408256 Len=87 TSval=1426732877 TSecr=1426732877"
"3579","0.000001","127.0.0.1","127.0.0.1","TCP","143","0.000047000","57271  >  8080 [PSH, ACK] Seq=1 Ack=1 Win=408256 Len=87 TSval=1426732877 TSecr=1426732877 [TCP segment of a reassembled PDU]"
"3595","0.000236","127.0.0.1","127.0.0.1","TCP","144","0.000058000","57273  >  8082 [PSH, ACK] Seq=1 Ack=1 Win=408256 Len=88 TSval=1426732878 TSecr=1426732878"
"3606","0.000227","127.0.0.1","127.0.0.1","TCP","142","0.000281000","57272  >  8080 [PSH, ACK] Seq=1 Ack=1 Win=408256 Len=86 TSval=1426732878 TSecr=1426732878 [TCP segment of a reassembled PDU]"
"3613","0.000140","127.0.0.1","127.0.0.1","TCP","144","0.000222000","57274  >  8082 [PSH, ACK] Seq=1 Ack=1 Win=408256 Len=88 TSval=1426732878 TSecr=1426732878"
"3624","0.000181","127.0.0.1","127.0.0.1","TCP","142","0.000154000","57275  >  8082 [PSH, ACK] Seq=1 Ack=1 Win=408256 Len=86 TSval=1426732878 TSecr=1426732878"
"3634","0.000187","127.0.0.1","127.0.0.1","TCP","141","0.000238000","57276  >  8082 [PSH, ACK] Seq=1 Ack=1 Win=408256 Len=85 TSval=1426732878 TSecr=1426732878"
"3644","0.000208","127.0.0.1","127.0.0.1","TCP","143","0.000243000","57277  >  8082 [PSH, ACK] Seq=1 Ack=1 Win=408256 Len=87 TSval=1426732879 TSecr=1426732878"
"3652","0.000142","127.0.0.1","127.0.0.1","TCP","143","0.000204000","57278  >  8082 [PSH, ACK] Seq=1 Ack=1 Win=408256 Len=87 TSval=1426732879 TSecr=1426732879"
"3664","0.000237","127.0.0.1","127.0.0.1","TCP","142","0.000221000","57279  >  8082 [PSH, ACK] Seq=1 Ack=1 Win=408256 Len=86 TSval=1426732879 TSecr=1426732879"
"3674","0.000171","127.0.0.1","127.0.0.1","TCP","143","0.000205000","57280  >  8082 [PSH, ACK] Seq=1 Ack=1 Win=408256 Len=87 TSval=1426732879 TSecr=1426732879"
"3686","0.000300","127.0.0.1","127.0.0.1","TCP","143","0.000339000","57281  >  8082 [PSH, ACK] Seq=1 Ack=1 Win=408256 Len=87 TSval=1426732879 TSecr=1426732879"
"3700","0.000383","127.0.0.1","127.0.0.1","TCP","142","0.000208000","57282  >  8082 [PSH, ACK] Seq=1 Ack=1 Win=408256 Len=86 TSval=1426732880 TSecr=1426732880"
"3714","0.000352","127.0.0.1","127.0.0.1","TCP","143","0.000150000","57283  >  8081 [PSH, ACK] Seq=1 Ack=1 Win=408256 Len=87 TSval=1426732880 TSecr=1426732880"
"3724","0.000249","127.0.0.1","127.0.0.1","TCP","144","0.000030000","57284  >  8081 [PSH, ACK] Seq=1 Ack=1 Win=408256 Len=88 TSval=1426732880 TSecr=1426732880"
"3736","0.000206","127.0.0.1","127.0.0.1","TCP","144","0.000052000","57285  >  8081 [PSH, ACK] Seq=1 Ack=1 Win=408256 Len=88 TSval=1426732881 TSecr=1426732881"
"3750","0.000402","127.0.0.1","127.0.0.1","TCP","141","0.000291000","57286  >  8081 [PSH, ACK] Seq=1 Ack=1 Win=408256 Len=85 TSval=1426732881 TSecr=1426732881"
"3758","0.000259","127.0.0.1","127.0.0.1","TCP","143","0.000045000","57287  >  8081 [PSH, ACK] Seq=1 Ack=1 Win=408256 Len=87 TSval=1426732881 TSecr=1426732881"
"3768","0.000243","127.0.0.1","127.0.0.1","TCP","143","0.000044000","57288  >  8082 [PSH, ACK] Seq=1 Ack=1 Win=408256 Len=87 TSval=1426732882 TSecr=1426732882"
"3778","0.000174","127.0.0.1","127.0.0.1","TCP","144","0.000033000","57289  >  8082 [PSH, ACK] Seq=1 Ack=1 Win=408256 Len=88 TSval=1426732882 TSecr=1426732882"
"3788","0.000176","127.0.0.1","127.0.0.1","TCP","144","0.000033000","57290  >  8082 [PSH, ACK] Seq=1 Ack=1 Win=408256 Len=88 TSval=1426732882 TSecr=1426732882"
"3798","0.000155","127.0.0.1","127.0.0.1","TCP","141","0.000030000","57291  >  8082 [PSH, ACK] Seq=1 Ack=1 Win=408256 Len=85 TSval=1426732882 TSecr=1426732882"
"3808","0.000189","127.0.0.1","127.0.0.1","TCP","143","0.000045000","57292  >  8082 [PSH, ACK] Seq=1 Ack=1 Win=408256 Len=87 TSval=1426732882 TSecr=1426732882"
